Tool Name,Kya Karega (Real Power),Jarvis Tier,Public Tiers,Real Mein Kaise Kaam Karega (Future)
Ancient Tech Decoder,"Shlokas ko decode karega (Viman Shastra, Samrangan Sutradhar, Rigveda) — hidden science nikale",Full,Off/Limited,LLM + Memory Graph + Reasoning se
Virtual Simulation Engine,"Viman/temple/astra ka physics/math simulation (velocity, energy flow, stability)",Full,Off,"Python code execution (sympy, numpy)"
Temple Geometry Analyzer,Temple photo daal kar Vastu + energy flow decode karega,Full,Limited,Image analysis (future multimodal LLM)
Scripture Cross-Reference,Ek scripture se dusre mein related shlok dhoondhega,Full,Limited,Vector search + Memory Graph
Ancient-Modern Blend Calculator,"Ancient formula ko modern science se match karega (e.g., Mercury Vortex → Ion Thruster)",Full,Off,Reasoning + Code Execution
Code Execution (Sandbox),"Safe Python code run (math, physics, simulation)",Full,Limited,Sandboxed exec (restricted globals)
Image Generation,Temple/viman diagrams generate karega,Full,Limited,Future image gen API (Stable Diffusion)
PDF Deep Analysis,PDF ka deep summary + hidden meaning nikalega,Full,Limited,RAG + Reasoning Layer
Web Search (Controlled),Modern research se compare karne ke liye,Full,Limited,Real web search API (brave/search)